{
  "schema_version": "1.0.0",
  "record_type": "project_state",
  "milestone": "M9",
  "phase": "Managed nonhuman graph and reusable assets accepted; managed cache, real HG001 evidence and hosted Explorer acceptance pending",
  "state": "in_progress",
  "version": "0.5.0-dev.1",
  "repositories": {
    "pipeline": {
      "full_name": "jcollins-bioinfo/giab-wes-nextflow",
      "branch": "main",
      "evidence_sha": "2e3b522c25c08e9e67b3f49d0bdfe65f9dcc58ab",
      "evidence_scope": "observed_prior_commit"
    },
    "website": {
      "full_name": "jcollins-bioinfo/john-collins-bioinformatics",
      "branch": "main",
      "evidence_sha": "b351a577191952540e084b191a8676a13c97d15c",
      "evidence_scope": "observed_prior_commit"
    }
  },
  "required_inputs": [
    {
      "id": "retained-M5-synthetic-proof",
      "status": "verified",
      "sha256": "cfda401c9504600d71f264452ad6b2f9cf858a6696a7636b6e22453283dd3533",
      "reason": "Retained Actions archive rehashed; original counts, partitions, isolation and Nextflow equivalence/resume verified. No HG001 metric."
    },
    {
      "id": "approved-coding-domain",
      "status": "verified",
      "sha256": "7730c4303e03fef74d2c22193102845e369e04ac81fabb7f41fae1374be65d00",
      "reason": "Owner-approved fixed chr20\u201322 coding/confidence intersection reproduced; execution still pending."
    },
    {
      "id": "managed-nonhuman-qualification-and-assets",
      "status": "verified",
      "sha256": "6b426a5321f8cf008eea72ce457bb7d6e5ac83ef6aec410803bc0b241c4b52c7",
      "reason": "September15 accepted milestone summary binds the complete 28-task nonhuman graph, full reference/classic BWA index and independent Broad known-sites assets. Historical receipt scope; not a fresh provider inventory."
    },
    {
      "id": "managed-cache-qualification",
      "status": "missing",
      "sha256": null,
      "reason": "Managed first/unchanged and six negative invalidation cases remain required; local Docker cache tests do not establish managed reuse."
    },
    {
      "id": "canonical-HG001-results",
      "status": "missing",
      "sha256": null,
      "reason": "Real chr20-22 execution, original-quality proof, accepted provider/scientific lineage and externally pinned public bundle remain required."
    }
  ],
  "local_tests": [
    {
      "name": "canonical-clean-clone-local-validation",
      "status": "passed",
      "evidence_sha": "2d89ecfc5f196c8d91960fcf4823dd90393b6be9",
      "command": "Clean-clone Python3.12/3.13 matrix, installed wheel, Nextflow lint/nf-test, package/schema/hygiene checks; affected isolated-package tests rechecked after task-environment repair.",
      "detail": "docs/orchestration/evidence/canonical-local-2d89ecf.json; initial failures preserved and explained. No canonical or browser execution."
    },
    {
      "name": "canonical-corrective-tests",
      "status": "passed",
      "evidence_sha": "667d6e7b4637269667445e9c00bc04ab209d4a4c",
      "command": "canonical unit subset on Python3.12/3.13; pyflakes canonical*.py; rebuilt wheel identity and distribution inventory",
      "detail": "71 tests pass on each version; driver import and interruption recovery corrections; canonical execution still pending. See canonical-corrective-validation.json."
    }
  ],
  "ci": [
    {
      "name": "initial-canonical-PR-CI",
      "required": true,
      "status": "success",
      "repository": "jcollins-bioinfo/giab-wes-nextflow",
      "evidence_sha": "2b35289db743c99a19f58e7b3d365297aa795584",
      "run_url": "https://github.com/jcollins-bioinfo/giab-wes-nextflow/actions/runs/34278960439",
      "job_urls": []
    }
  ],
  "execution_environments": [
    {
      "id": "healthomics-nonhuman-26040-v2",
      "status": "executed",
      "os": "Linux",
      "architecture": "x86_64",
      "canonical": false,
      "run_id": "provider-receipt-sha256:eeeed172bdc6326105cfe2dba481dec5a6f08784ba259ec5cae5af94d584ad76",
      "evidence_artifacts": [
        "docs/orchestration/evidence/managed-qualification-20260915.json"
      ]
    }
  ],
  "publication": {
    "drive": "not_published",
    "public_evidence": "partial",
    "deployment": "not_deployed",
    "release": "not_released",
    "authorization_reference": "Scientific acceptance and deployment admission remain separate; DNS is owner-managed.",
    "evidence_artifacts": [
      "docs/orchestration/evidence/managed-qualification-20260915.json",
      "docs/orchestration/checkpoints/pre-managed-project-state.json"
    ]
  },
  "external_blockers": [
    {
      "id": "managed-cache-and-human-acceptance",
      "gate": "canonical HG001 results",
      "reason": "Accepted uncached nonhuman execution does not establish managed cache validity or HG001 scientific acceptance. Current paid-run admission and independent supervision must pass before submission.",
      "owner_action": "Review the concrete private admission checkpoint when a new paid phase is ready."
    },
    {
      "id": "hosted-Explorer-acceptance",
      "gate": "public app hosting",
      "reason": "Exact final image/evidence, bounded memory qualification, current hosting admission and provider HTTPS verification remain required.",
      "owner_action": "Enter generated DNS records manually only after provider verification supplies actual records."
    }
  ],
  "next_safe_action": "Qualify the managed cache cases against the exact production package/engine/parser, then admit the fixed HG001 run and validate the returned public evidence. Preserve missing human measurements while presenting accepted nonhuman metadata.",
  "observed_at": "2026-10-05T03:50:53.226803+00:00"
}
